Date,Name,Year,Letterboxd URI,Rating,Rewatch,Review,Tags,Watched Date
2024-10-18,The House of the Devil,2009,https://boxd.it/7A3dmZ,3.5,Yes,"watched with reese, rick, and canadian jamie","shudder, garbage",2024-10-18
2024-10-19,The Wicker Man,1973,https://boxd.it/7AuRr5,5,Yes,"a christian cop will literally harass an entire island of people, assault a man and steal his costume to hide his identity, and generally doth protest too much about the sexual freedom expressed by others while we all saw what he was doing his first night on the island, and STILL he will have the balls to say ""god damn you all to hell"" because the people he's been denigrating the entire time finally have enough and ritually sacrifice him in order to bring a bountiful harvest by burning him.","primevideo, garbage",2024-10-18
2024-10-21,Jeepers Creepers 2,2003,https://boxd.it/7BD3zF,2.5,,watched with guffy and mj :],"youtube, garbage",2024-10-20
2024-10-22,OtherLife,2017,https://boxd.it/7CfqOT,4,,fucken great movie,"youtube, garbage",2024-10-21
2024-10-22,Annihilation,2018,https://boxd.it/7ChpNz,4,Yes,"i love this movie. it's not a perfect adaptation of the source material, but it is high quality and packs a lot of punches. ","youtube, garbage",2024-10-21
2024-10-23,Doctor Sleep,2019,https://boxd.it/7CDio7,4,Yes,hell yeah. 4 stars for the director's cut.,"primevideo, garbage, directors cut",2024-10-22
2024-10-24,Donnie Darko,2001,https://boxd.it/7CSpgp,5,Yes,the directors cut is free on youtube,"directors cut, garbage",2024-10-23
2024-10-24,Caddo Lake,2024,https://boxd.it/7CWo0j,2.5,,"my stepsister is my grandma?
i saved my mom's life?

what is this movie?",max,2024-10-23
2024-10-24,The Witch,2015,https://boxd.it/7D5CIn,4,Yes,watched in theaters for the first time,"in theaters, imax, moviepass",2024-10-23
2024-10-25,Late Night with the Devil,2023,https://boxd.it/7Dt6UT,3,Yes,watched with jaska and yared,"fellas, shudder",2024-10-24
2024-10-25,Arcadian,2024,https://boxd.it/7DuxYP,2,,hungry hungry hippo ass monsters ,shudder,2024-10-24
2024-10-28,Conclave,2024,https://boxd.it/7F9OCH,4,,"wow.

watched with collin, brooke, garrtt, bailey, and sambobomb","moviepass, in theaters",2024-10-27
2024-10-29,Enemy,2013,https://boxd.it/7FOtkz,4.5,Yes,"this is a horror movie if you are a man afraid of women

no other notes",bluray,2024-10-28
2024-10-30,Daddy's Home,2015,https://boxd.it/7GihnB,3,," this does a decent job earning its feel-good ending.

watched with roachdog, bivz, mj, guffy, jaimz, and lolo.",garbage,2024-10-29
2024-10-30,The Faculty,1998,https://boxd.it/7GjZhT,4.5,Yes,"watched with mj, roachdog, guffy, jaimz, and lolo","garbage, youtube",2024-10-29
2024-11-03,Ready or Not,2019,https://boxd.it/7IjV3V,3.5,,"""And then I met Grace...""

<i>Ready or Not</i> asks you to invest in its themes. This is truly a movie-lover's movie, as far as I'm concerned.

This is an absolute treat in regard to story, but it delivers on so much more. As an exploration in the white wedding culture that dominates southern culture in the same industry, this film expresses a horror that very few have openly vocalized in public. Weddings in the Deep South ask too much of the bride, and Samara Weaving embodies the dark nature of this ritual with some necessary revenge.

What a delightful treasure trove of tradition and treachery! ","hulu, garbage",2024-11-02
2024-11-04,Random Acts of Violence,2019,https://boxd.it/7IMY0X,2.5,,well this is a movie,"shudder, garbage",2024-11-03
2024-11-04,"Dude, Where's My Car?",2000,https://boxd.it/7J78jl,3,Yes,shibby,"garbage, hulu",2024-11-03
2024-11-06,Idiocracy,2006,https://boxd.it/7K1y5V,3,Yes,this wasn't meant to be a documentary.........HARRIZ WALZ 2024,"garbage, hulu",2024-11-05
2024-11-06,Mirror,1975,https://boxd.it/7K5c9J,,Yes,"Forensic doctor: You know, I fell and found strange things here - roots, bushes... Has it ever occurred to you that plants can feel, know, even comprehend? The trees, this hazelnut bush...
Natalya: This is an alder tree.
Forensic doctor: It doesn't matter. They don't run about. Like us who are rushing, fussing, uttering banalities. That's because we don't trust nature that is inside us. Always this suspiciousness, haste, and no time to stop and think.","criterion, bluray",2024-11-05
2024-11-07,The Ninth Configuration,1980,https://boxd.it/7Keixl,,,“he gave up his life”,primevideo,2024-11-06
2024-11-07,Saltburn,2023,https://boxd.it/7Ks6Kl,4.5,Yes,watched with lolo,"primevideo, garbage",2024-11-06
2024-11-10,Incendies,2010,https://boxd.it/7LQGqN,5,Yes,this commands your attention,"lovvorn, 4k",2024-11-09
2024-11-11,Pandorum,2009,https://boxd.it/7My53Z,3,,lmao my buddy tyler was streaming this in discord and tyler's power went out so i had to stream the last 10 minutes and we had to sit through 6 minutes of ads on the streaming service ,"primevideo, garbage",2024-11-10
2024-11-11,Coherence,2013,https://boxd.it/7MAmlF,3.5,Yes,this is a relationship drama that uses the multiverse to reveal the conflict between the protagonist and her partner. it's fun to revisit this with new people.,"garbage, primevideo",2024-11-10
2024-11-12,Barry Versus The Binman,2023,https://boxd.it/7N77aX,3.5,,leaf blowers are the most pointless things ever invented,"garbage, youtube, omeleto",2024-11-12
2024-11-13,Heretic,2024,https://boxd.it/7Nv2Xj,3.5,,Hugh Grant,in theaters,2024-11-12
2024-11-15,Paul Blart: Mall Cop 2,2015,https://boxd.it/7OkwjF,2,,watched with josh while playing helldivers 2,garbage,2024-11-14
2024-11-17,Smile 2,2024,https://boxd.it/7PbELX,4,,"watched with jack mazza

i’m glad i watched it in the theater","in theaters, cinemarkmovieclub, mazza",2024-11-16
2024-11-17,The Hangover,2009,https://boxd.it/7PvnhV,4,,"watched with jaimz, mj, and gali","garbage, max",2024-11-17
2024-11-17,Trap,2024,https://boxd.it/7PwNiR,3.5,Yes,"watched with jaimz, mj, and gali","max, garbage",2024-11-17
2024-11-18,The Cowboy and the Frenchman,1988,https://boxd.it/7PIKXL,4,,hilarious,"short films big names, mubi",2024-11-17
2024-11-18,Nathan for You: Finding Frances,2017,https://boxd.it/7PQXJ9,5,,2024 is the year i embrace Nathan Fielder (I have willfully resisted until this point),"garbage, max, profile",2024-11-17
2024-11-20,Sister Act,1992,https://boxd.it/7QWoml,4.5,,this film is filled with joy,"youtube, garbage",2024-11-19
2024-11-23,The Ring,2002,https://boxd.it/7SllHT,3.5,,"watched with jaime, jamie, and reese","garbage, youtube",2024-11-22
2024-11-24,Marcel the Shell with Shoes On,2021,https://boxd.it/7SV233,5,,absolutely lovely,"4k, max",2024-11-23
2024-11-29,Firebringer,2016,https://boxd.it/7VqpJL,3.5,Yes,watched with Alan,youtube,2024-11-28
2024-12-01,Gladiator II,2024,https://boxd.it/7WxE0J,2.5,,"this certainly is a <i>Gladiator</i> movie

Paul Mescal looks the part but I don't believe him. I don't believe most of the characters. And I didn't care about the plot.

The whole movie just seemed to be a worse copy of the original that also includes highlight reels from the original, just to remind you how good that movie was.

I'm disappointed because it seems like all the ingredients were there, they just didn't get cooked. ","lovvorn, imax, moviepass, profile",2024-11-30
2024-12-03,Stations of the Elevated,1981,https://boxd.it/7Xzpr9,4,,i do not regret committing to this,tubi,2024-12-02
2024-12-03,Voyage of Time: The IMAX Experience,2016,https://boxd.it/7XAwBn,2.5,,ew,mubi,2024-12-02
2024-12-03,Sermon on the Mount,2019,https://boxd.it/7XBPVj,4.5,,love,max,2024-12-02
2024-12-07,Beyond the Infinite Two Minutes,2020,https://boxd.it/7ZlFi3,4.5,,really fun and lovely,"primevideo, garbage",2024-12-06
2024-12-08,The Apprentice,2024,https://boxd.it/7ZG4NP,3.5,,not surprised that the donald trump movie is super gay,primevideo,2024-12-07
2024-12-08,Owning Mahowny,2003,https://boxd.it/8040qZ,4,,watched with reese and canadian jamie,garbage,2024-12-08
2024-12-09,Twinkle,2019,https://boxd.it/80A8Mj,2.5,,an ending makes or breaks a film.,"alter, youtube",2024-12-08
2024-12-09,Accidental Stars,2024,https://boxd.it/80Ax8t,4.5,,nails it,"alter, youtube",2024-12-08
2024-12-10,The Pig Child,2014,https://boxd.it/80NgFB,4,,this short celebrates its 10-year anniversary this year. dreadfully compelling horror short.,"alter, youtube",2024-12-09
2024-12-10,Beau Is Afraid,2023,https://boxd.it/814xKx,4.5,Yes,"watched with tyler, who didn't see the first 15 minutes or the last 5.","primevideo, garbage",2024-12-09
2024-12-10,Reptile,2023,https://boxd.it/818gbt,3,,watched with cj and reese,garbage,2024-12-10
2024-12-13,The Blob,1958,https://boxd.it/828TyP,,,"The End<strong>?</strong>

<i>as long as the arctic stays cold</i>",max,2024-12-12
2024-12-13,Paradise,2023,https://boxd.it/82uR5P,3,,"#FreeLuigi
-
cool soundtrack. so much of the plot was <i>convenient</i>, but i felt something. 
<br>
<blockquote>""you promised you would help me""</blockquote>",garbage,2024-12-13
2024-12-16,I Care a Lot,2020,https://boxd.it/84cX8d,3.5,,"wow this ending hits hard today

#FREELUIGI

watched with reese, jaimz, and tsw","netflix, garbage",2024-12-16
2024-12-17,Hide Your Crazy,2023,https://boxd.it/84pz1t,4,,horrific and cute? idk how but this pulls it off,"youtube, alter",2024-12-16
2024-12-17,Challengers,2024,https://boxd.it/84u65r,4.5,Yes,i fucking love this movie,"primevideo, fellas",2024-12-16
2024-12-18,The Lord of the Rings,1978,https://boxd.it/85hTFV,3,,ngl pretty disappointed ,max,2024-12-17
2024-12-19,No Country for Old Men,2007,https://boxd.it/85DmwP,5,,watched with the homies,"garbage, youtube",2024-12-18
2024-12-22,Nosferatu,1922,https://boxd.it/87kuZv,4.5,,this marks 500 films logged for 2024,youtube,2024-12-21
2024-12-24,ZIT,2024,https://boxd.it/88ID8d,3,,"good music. overacted, but that's just a device used to make the point clear. it's a strong entry, i would like to see more from this filmmaker. ","alter, garbage, youtube",2024-12-23
2024-12-26,The Matrix,1999,https://boxd.it/89Wy8T,5,Yes,i highly recommend watching this first thing xmas morning with the sibling (or alternative) of your choice,bluray,2024-12-25
2024-12-26,The Green Knight,2021,https://boxd.it/8amLAj,5,Yes,xmas viewing with the fam,bluray,2024-12-25
2024-12-27,Born Again,2017,https://boxd.it/8bduq3,4.5,,yes okay clearly weird -- i liked it,"alter, youtube",2024-12-26
2024-12-27,Red Eye,2005,https://boxd.it/8biqLh,3.5,,i love this specific era of cellular voice technology and these specific main and supporting actors,youtube,2024-12-26
2024-12-28,Nosferatu,2024,https://boxd.it/8chygj,4,,"Robert Eggers knows how to make a movie that can sound both pleasant and disturbing. unrelated, but this is the first time i've been to a theater since the middle of November.","in theaters, moviepass",2024-12-27
2024-12-29,Hackers,1995,https://boxd.it/8dhjRN,4.5,Yes,this releasing before <i>The Matrix</i> is like John the Baptist coming before Jesus,"youtube, garbage",2024-12-29
2024-12-30,Secret Level - Dungeons & Dragons: The Queen's Cradle,2024,https://boxd.it/8dGk9n,3.5,,LFG,"primevideo, garbage",2024-12-29
2024-12-30,Secret Level - Unreal Tournament: Xan,2024,https://boxd.it/8dIbH5,4.5,,ROCKET JUMP!,"garbage, primevideo",2024-12-29
2024-12-30,Secret Level - Crossfire: Good Conflict,2024,https://boxd.it/8dL4xj,1.5,,no one's the bad guy. ,"garbage, primevideo",2024-12-29
2024-12-30,Secret Level - Mega Man: Start,2024,https://boxd.it/8dN87N,3.5,,great but way too short,"primevideo, garbage",2024-12-29
2024-12-31,A Complete Unknown,2024,https://boxd.it/8ePTPF,4.5,,"i'll be honest... i loved this. i'm not a bob dylan fan, but that's not to say i'm not NOT a fan -- just unfamiliar. as a fan of movies, i really enjoyed getting to know bob dylan the person through his songs as performed by bob dylan the character. i recognized some and heard some new ones. the main thing i learned was that bobby didn't like to repeat himself, which i find infinitely relatable.

as far as characters go, i really enjoyed chalamet's performance. Monica Barbaro was a fun match up. i'm grateful for some other familiar faces in the support cast like Scoot McNairy and Edward Norton and Elle Fanning. the fact that this film is light on the facts and leans more into <i>how</i> Bobby lives and loves worked for me. 

it's no <i>Dune</i> pt 2 but it's a lovely cap to this year","in theaters, moviepass, profile",2024-12-30
2025-01-02,But I'm a Cheerleader,1999,https://boxd.it/8gT1x9,5,Yes,starting 2025 super gay,garbage,2025-01-01
2025-01-04,Shadow,2024,https://boxd.it/8j8qpR,3,,"interesting, if unsubtle. i would not call this horror.","alter, youtube",2025-01-04
2025-01-05,Boys State,2020,https://boxd.it/8kf1H5,4,Yes,where is GIRLS STATE?,"appletv+, garbage",2025-01-04
2025-01-09,The NeverEnding Story,1984,https://boxd.it/8nqm51,4.5,,"oh yeah, that's the stuff right there","youtube, cspiregaming",2025-01-08
2025-01-11,Cunk on Life,2024,https://boxd.it/8pwyQN,4,,with this and the new <I>Wallace and Gromit</I> I'm just having a little day with Diane Morgan,netflix,2025-01-10
2025-01-12,A Complete Unknown,2024,https://boxd.it/8rgNCd,4.5,Yes,watched with johnny at Regal New Valley,"in theaters, moviepass",2025-01-11
2025-01-13,The Social Network,2010,https://boxd.it/8sdfeJ,4,Yes,"after the zuck's recent actions i'm on board the train to get a sequel biopic -- i don't know if anything like that has ever been done before but this deserves the treatment. 

i don't love zuckerberg in the slightest, so i am confounded by the last line of dialogue from Rashida Jones' character Marilyn Delpy, ""Mark, you aren't an asshole. You just tried so hard to be one."" 

also, while revisiting this film after <i>Challengers</i> i think i noticed some repeating melodic ideas -- not sure what that means. the song <a href=""https://open.spotify.com/track/2FVh8jIZ1uO88bBQ8fi6W6?si=170908896fcf43aa"" rel=""nofollow"">""L'ouef""</a> from the former has some of the same piano as the end credits of this move.",primevideo,2025-01-12
2025-01-13,Dream Scenario,2023,https://boxd.it/8sty59,,Yes,"this is the first time i've watched this since i saw it in theaters... i still refuse to rate it.

it might be genius, or it might just be a stupid metaphor (dreams === movies). either way, i do know i liked it.","max, garbage",2025-01-12
2025-01-14,Mr. Know it All,2024,https://boxd.it/8t2aGF,,,"Bashar, I enjoyed it. Keep working.","youtube, letterboxd member",2025-01-13
2025-01-15,Salvatore,2017,https://boxd.it/8tvAu9,4,,bloody and operatic ,"youtube, alter",2025-01-14
2025-01-15,Nosferatu the Vampyre,1979,https://boxd.it/8tXZFn,4,,lmao this is so weird,"youtube, shout! studios",2025-01-14
2025-01-17,Mulholland Drive,2001,https://boxd.it/8v2CZ9,5,,"the cinematic equivalent of ""pour one out for your homie"" is to play your favorite film from a director to honor their passing.

it is probably romanticizing it but maybe david lynch's heart was broken by the destructive fires in LA. he loved the city and its lights. ","criterion, bluray",2025-01-16
2025-01-20,Munchausen,2013,https://boxd.it/8xmnGT,3,Yes,"<blockquote>By nursing secret destructive attitudes, a wife can drive her husband, and a mother her children, into illness, accident, or even death. Or she may decide to keep the children from marrying—a deeply hidden form of evil that rarely comes to the surface of the mother's conscious mind. (A naïve old woman once said to me, while showing me a picture of her son, who was drowned when he was 27: ""I prefer it this way; it's better than giving him away to another woman."")</blockquote><blockquote>
A strange passivity and paralysis of all feeling, or a deep insecurity that can lead almost to a sense of nullity, may sometimes be the result of an unconscious animus opinion. In the depths of the woman's being, the animus whispers: ""You are hopeless. What's the use of trying? There is no point in doing anything. Life will never change for the better.""</blockquote>The process of individuation: Animus, the man within
 M-L von Franz, excerpt from <i>Man and His Symbols</i>",youtube,2025-01-19
2025-01-21,O.C.D. (Obsessor Coercio Deus),2025,https://boxd.it/8yakV7,4,,"i almost thought it wouldn't stick the landing, but it did.

recommended by Vinny",youtube,2025-01-20
2025-01-23,Tuesday,2015,https://boxd.it/8A9MaJ,4,,the juxtaposed sound to silence... ,vimeo,2025-01-22
2025-01-24,A Complete Unknown,2024,https://boxd.it/8AMIhf,4.5,Yes,this is my third time. i wanted to support the Capri before it left their single screen. i wish they weren’t so controlled by Disney and could show cool shit.,in theaters,2025-01-23
2025-01-24,Blue Christmas,2017,https://boxd.it/8APVlP,5,,"thank you, random korean youtube channel that uploaded this","youtube, garbage",2025-01-23
2025-01-26,Sonic the Hedgehog 3,2024,https://boxd.it/8Cb4iV,4,,i love jim carrey,"in theaters, cinemarkmovieclub, jsyd",2025-01-25
2025-01-27,The Lord of the Rings: The Two Towers,2002,https://boxd.it/8D3Dnf,5,Yes,my brother (despite having lived with me between 2001 -2007) has never seen any LOTR movies so we are fixing that with a healthy dosing of the extended editions,bluray,2025-01-26
2025-01-27,The Lord of the Rings: The Return of the King,2003,https://boxd.it/8DkXTz,5,Yes,"watching this now really gives me hope that the Academy will treat Villeneuve's <i>Dune Messiah</i> like this film.

also, i need to give this bluray set back to its original owner.",bluray,2025-01-26
2025-01-30,Meat Puppet,2024,https://boxd.it/8Fc0AP,4.5,,"well... i had the thought when he put the puppet on, ""if the rule holds, then the puppet has to stick its hand inside of the man to reverse it"" and then that was literally the ending.

i fucking love movies ","youtube, short of the week",2025-01-29
2025-01-30,The Brutalist,2024,https://boxd.it/8FwhfT,4,,i caught this in the IMAX before it leaves,"imax, moviepass, in theaters",2025-01-29
2025-01-31,Let,2024,https://boxd.it/8FHLuB,3.5,,I love it when they make out,"youtube, short of the week",2025-01-30
2025-01-31,Presence,2024,https://boxd.it/8FZVqF,3,,"this didn’t do enough with its concept, but it still told a story. i liked the ending, but the beginning really should have stretched some of the concept by having the ghost experiment more. this does well to balance its plot in the last half -- very masterful. ","in theaters, moviepass",2025-01-30
2025-02-02,Hereditary,2018,https://boxd.it/8HhGRB,4,Yes,"when I showed this to my sister 4 years ago, she did not like it. I wonder what she would think today.

also i bet the treehouse smells so wild ",appletv,2025-02-01
2025-02-03,Evangelion: 1.0 You Are (Not) Alone,2007,https://boxd.it/8IsCtV,4,,"hmm... first impression rating. i enjoyed this, but if it was my first watch i would have checked out because of the voice acting for shinji.

watched with hunter","cspiregaming, primevideo, hunnit",2025-02-02
2025-02-03,Groundhog Day,1993,https://boxd.it/8IwmdZ,5,Yes,i usually celebrate privately... but this year i streamed this in discord,garbage,2025-02-02
2025-02-12,Night Session,2024,https://boxd.it/8Ofsbb,4.5,,fucken loved it. really great short,"omeleto, garbage",2025-02-11
2025-02-13,The Brutalist,2024,https://boxd.it/8OR551,4,Yes,watched with Mary,"in theaters, merry",2025-02-12
2025-02-14,This World Is Not My Own,2023,https://boxd.it/8PlFEV,4,,Watched at the Mississippi Museum of Art as part of the Southern Series circuit,msfilmsociety,2025-02-13
2025-02-14,The Menu,2022,https://boxd.it/8PpL5P,4,Yes,"watched with reese, gali, pony, rick, jaimz, and vayp",big brain,2025-02-13
2025-02-14,Naysayer,2019,https://boxd.it/8Pqz2B,4,,it hit me,"big brain, youtube, omeleto",2025-02-13
2025-02-16,Tenet,2020,https://boxd.it/8QNiEj,4,Yes,"this movie is so cool.

watched with jeana, micah, hannah, and larry",bluray,2025-02-15
2025-02-17,Tenet,2020,https://boxd.it/8Rp2zj,4,Yes,"this is a movie about climate change.

watched with mj","primevideo, garbage",2025-02-16
2025-02-18,Interstellar,2014,https://boxd.it/8SjWUJ,4.5,Yes,"watched with mj, gali, guffy, jaimz, lolo, rick, and the wrong garrett",garbage,2025-02-17
2025-02-20,Rebel Ridge,2024,https://boxd.it/8TxJKN,3.5,,"with jaimz, mj, lolo, guffy, rick, and josh","garbage, netflix",2025-02-19
2025-02-21,Dune,2021,https://boxd.it/8U7nYv,5,Yes,broke in the 4kuhd,4k,2025-02-20
2025-02-23,Perfect Days,2023,https://boxd.it/8VrKYR,5,,I chose this for Shelby’s birthday.,"4k, criterion, shelby",2025-02-22
2025-02-25,Twin Peaks,1989,https://boxd.it/8WSNDb,4.5,,happy twin peaks day to all who celebrate,dvd,2025-02-24
2025-02-28,Moonlight,2016,https://boxd.it/8YuNZh,5,Yes,this is so immersive in IMAX,"imax, in theaters, moviepass",2025-02-27
2025-03-05,Disaster Movie,2008,https://boxd.it/91UFRj,2.5,,watched with reese and josh,garbage,2025-03-04
2025-03-06,Ikarie XB 1,1963,https://boxd.it/92noIR,3.5,,"the thought occurred to me: had my grandparents been big movie watchers, i wonder if there’s a universe they would have seen a movie like this around the time they had my mother.

i found the writing to be compelling but the set design… did not feel good",bluray,2025-03-05
2025-03-07,Mickey 17,2025,https://boxd.it/92ZXCl,4.5,,"a lot of fun but also a mess, narratively. 
feels like an amalgam of Bong Joon Ho tropes.

- I love Robert Pattinson’s acting 
- Title card at 35 minutes in the runtime is so much fun
- The title (and in general, just having watched a lot of movies) tells you everything (I mean, the plot is not subtle at all)
- The evil characters are comedic and just present enough on screen to deserve their foils; Mark Ruffalo seems to be having a real good time, and Toni Collette manages to terrify as well as tickle
- Naomi Ackie!!! she played self-possessed, protective girlfriend so well
- The creepers are kinda cute, and I love this whole talking animals thing we have going on (I wonder if Bong Joon Ho plays a Bard, or maybe a Druid)

Watched with Jeana, Micah, Zack, and Foster","in theaters, moviepass, profile",2025-03-06
2025-03-08,The Patriot,2000,https://boxd.it/93wTAL,3,,"in the movies logged among my All Time stats on Letterboxd, this movie is the 1,776th

watched with jake, john, and reese",primevideo,2025-03-07
2025-03-10,No Country for Old Men,2007,https://boxd.it/94ZzyR,5,Yes,watched with Jake,"primevideo, garbage",2025-03-09
2025-03-10,Mickey 17,2025,https://boxd.it/95a0ih,4.5,Yes,rewatch in IMAX. worth.,"imax, in theaters, moviepass",2025-03-09
2025-03-10,The Gorge,2025,https://boxd.it/95hNZD,3,,"on paper I was not interested but when someone asked me to stream it I was down for it and we gave it the MST3K treatment and had a blast. with the premise and the execution, it's the kinda movie built for this stuff. 

watched with Jamie, Reese, rick, and josh","garbage, appletv+",2025-03-09
2025-03-12,Hugh,1996,https://boxd.it/96o7D9,4.5,,"Wow. I didn’t think I’d ever see something like this in my living room. Granted, I know nothing about Joshua Oppenheimer and am just jumping in to these short films.",dvd,2025-03-11
2025-03-13,Tristan & Isolde,2006,https://boxd.it/96VOb9,2,,at least there are hot people,dvd,2025-03-13
2025-03-16,Ice Age: The Meltdown,2006,https://boxd.it/98CzeR,3,,Watched with Alan and mom,dvd,2025-03-15
2025-03-17,Harry Potter and the Philosopher's Stone,2001,https://boxd.it/99sFuZ,3.5,Yes,watched with Alan and mom,max,2025-03-16
2025-03-18,Harry Potter and the Prisoner of Azkaban,2004,https://boxd.it/99FYaZ,4.5,Yes,"Watched with Alan and mom. He saw <i>Chamber of Secrets </i>with her, too, but I didn’t sit for that one. This one is my favorite of the series because of the new Dumbledore, first and foremost, and Alan liked the change, too.",max,2025-03-17
2025-03-20,Daaaaaalí!,2023,https://boxd.it/9b6aT9,3.5,,it made me laugh,mubi,2025-03-19
2025-03-21,The House That Jack Built,2018,https://boxd.it/9bsGZR,4.5,Yes,garrett watched the last half. he was disgusted and yet interested,"garbage, mubi",2025-03-20
2025-03-23,Novocaine,2025,https://boxd.it/9cIfW3,3.5,,"this was fun as fuck with great physical comedy. but those villains were so vanilla.

watched with aaron, jaime, and nanda","in theaters, moviepass",2025-03-22
2025-03-24,A Knight's Tale,2001,https://boxd.it/9dg2hf,4.5,,i fucken love movies,"primevideo, garbage",2025-03-23
2025-03-25,Tenet,2020,https://boxd.it/9e5yOd,4,Yes,"i stood 3 feet away and studied this like a painting in a museum. 
watched in 4K Ultra HD.",4k,2025-03-24
2025-03-31,Greetings,,https://boxd.it/9h1fmt,4.5,,incredible,youtube,2025-03-30
2025-04-01,Mobile Suit Gundam Narrative,2018,https://boxd.it/9hVION,3.5,,"i liked it despite knowing nothing. 

watched with jake.","garbage, crunchyroll",2025-03-31
2025-04-02,Bring Them Down,2024,https://boxd.it/9itlol,5,,"harrowing.

i will miss my Mubi subscription but i am not happy with my experience since the film of the day is no longer the differentiator. 

i'll catch any Mubi releases in theaters, though","mubi, garbage",2025-04-01
2025-04-03,Mr. Smith Goes to Washington,1939,https://boxd.it/9iRQoz,5,,"let's fucken go.

watched with garrett and mj","garbage, primevideo",2025-04-02
2025-04-05,Finding Nemo,2003,https://boxd.it/9jZuAD,3.5,,"delightful

watched with patrick, reese, jaime, jamie, and john",garbage,2025-04-04
2025-04-06,Ratatouille,2007,https://boxd.it/9kiBXH,4.5,,"wow-- so much greater than i remember. maybe i was pretty cynical when i originally saw this back then after it released

watched with john, garrett, jaime, jamie, mj, and gibby",garbage,2025-04-05
2025-04-06,The Incredibles,2004,https://boxd.it/9kB3XL,4,,"with this entry, i've now logged 2+ films on 500 different days.

watched with john, jaime, mj, and garrett",garbage,2025-04-05
